{"authority":{"authority_effect":"NONE","claim_boundary":"UNBOUND_CONFIGURATION_ONLY","release_gate":false,"self_admission":false,"standing":"INFORMATION_ONLY","track_a_dependency":"NONE"},"axes":[{"authority_effect":"NONE","continuity":"DISCRETE","default":"X64","domain":{"values":["ARM64","RISCV64","X64"]},"id":"TARGET_ISA","label":"Target instruction set","mutability":"INSTANCE","ownership":"AUTHORIAL","value_type":"ENUM"},{"authority_effect":"NONE","continuity":"DISCRETE","default":4096,"domain":{"maximum":1048576,"minimum":128},"id":"MEMORY_MIB","label":"Memory capacity","mutability":"INSTANCE","ownership":"AUTHORIAL","unit":"MiB","value_type":"INTEGER"},{"authority_effect":"NONE","continuity":"DISCRETE","default":false,"domain":{},"id":"SELF_HOSTED_AGENT","label":"Self-hosted agent environment","mutability":"INSTANCE","ownership":"AUTHORIAL","value_type":"BOOLEAN"},{"authority_effect":"NONE","continuity":"DISCRETE","default":"DISABLED","domain":{"values":["DISABLED","ETHERNET_LOCAL_ONLY"]},"id":"NETWORK_BOOTSTRAP","label":"Bootstrap transport","mutability":"INSTANCE","ownership":"AUTHORIAL","value_type":"ENUM"}],"capabilities":["ENUMERATE","VALIDATE","NORMALIZE","SELECT","LOWER","COMPARE","EXPLAIN","RECEIPT","PROJECT","TRACE"],"constraints":[{"explanation":"Memory must remain within the declared portable target envelope.","id":"MEMORY_WITHIN_PORTABLE_BOUND","kind":"BUDGET","operator":"RANGE","refusal_code":"PORTABLE_MEMORY_BOUND_REFUSED","severity":"HARD","terms":{"axis":"MEMORY_MIB","maximum":1048576,"minimum":128}},{"explanation":"The bootstrap profile remains externally driven until a later governed self-hosting transition.","id":"ETHERNET_PRECEDES_SELF_HOSTING","kind":"DEPENDENCY","operator":"REQUIRES","refusal_code":"BOOTSTRAP_SELF_HOSTING_ORDER_REFUSED","severity":"HARD","terms":{"if":{"axis":"NETWORK_BOOTSTRAP","equals":"ETHERNET_LOCAL_ONLY"},"then":{"axis":"SELF_HOSTED_AGENT","equals":false}}}],"contract_id":"UCM.PORTABLE_AGENT_ENVIRONMENT","contract_version":"0.1.0","description":"Unbound portable agent environment realization space.","evidence":{"non_claims":["NO_TARGET_ADMISSION","NO_NETWORK_AUTHORITY","NO_PRODUCTION_AUTHORITY"],"required_fields":["standing","authority_effect"],"required_roots":["CONTRACT","SUBJECT","CONFIGURATION","IMPLEMENTATION","OUTPUT"]},"lowering":{"allowed_results":["EXACT","BOUNDED","FALLBACK","LOSSY","REFUSED"],"targets":[{"adapter_version":"0.1.0","fallbacks":[],"known_losses":[],"optional_capabilities":[],"preservation_criteria":["UCM_CONTRACTS","AUTHORITY_CEILING"],"required_capabilities":[],"runtime_family":"UNBOUND","target_id":"UNBOUND_COMPUTE_TARGET"}]},"objectives":[{"direction":"MINIMIZE","measurement":"exact packaged bytes","metric_id":"ARTIFACT_BYTES","priority":100,"scope":"PORTABLE","unit":"bytes"}],"possibility":{"excluded_claims":["target admission","network permission","production readiness","real identity binding"],"intended_variation":["processor architecture","memory capacity","local agent hosting","bootstrap transport"]},"schema":"mosaic.realization-space-contract.v0.1","selection":{"default_policy":"EXACT_DEFAULTS","fallback_policy":"REFUSE","policies":["EXACT_DEFAULTS","OBJECTIVE_PRIORITY"],"seed_required_for_non_unique":false},"subject":{"authority_owner":"UNBOUND","forbidden_overrides":["IDENTITY","AUTHORITY","NETWORK_AUTHORITY","PRODUCTION_ADMISSION"],"preserved_identity":["UCM_CONTRACTS","UCM_CAPABILITIES","AUTHORITY_CEILING"],"source_roots":["sha256:0000000000000000000000000000000000000000000000000000000000000000"],"subject_id":"UCM.PORTABLE_AGENT_ENVIRONMENT","subject_schema":"mosaic.ucm.portable-agent-environment.v0.1"}}
